,Gouvernorat,Nature,Type,Description,Price,Insertion Date
1386,ben arous,Vente,Appart. 3 pièces');,"Appartement 3 chambres village mediteraneen rades vends appartement s+3 salle de bain salle d eau grand salon 2 climatiseurs sechoir et place parking personnel , bloc 39  toutes les commodités (lycée, nurseries,banque,poste,commerces,etc)  ti ...');",185000.0,15/10/2024 12:53
1387,tunis,Vente,Appart. 4 pièces');,"Appart al nahar à tunis un appart au 3éme étage situé dans un immeuble au coeur du centre ville, tunis. a l entrée, on a un salon avec balcon, une cuisine, 3 chambres et une salle de bain. pour tous les renseignements, conta ...');",180000.0,15/10/2024 12:15
1388,tunis,Vente,Appart. 3 pièces');,"Appart s3 celian à centre ville tunis un appart s3 au 3ème étage situé dans une résidence à centre ville tunis. a l entrée, on trouve un salon, une cuisine équipée, trois chambres à coucher et une salle de bain. pour tous les renseignemen ...');",250000.0,15/10/2024 11:15
1389,ben arous,Vente,Appart. 2 pièces');,Bon affaire s2 au rdc prix 148.000dt /s+2/ boumhal / rdc/85m²  opportunité :à vendre s+2 au rez de chaussée à boumhal (cité trés demandé prés de tt les commodités)  tel et whatsapp  28 700 810');,148000.0,14/10/2024 23:07
1390,tunis,Vente,Appart. 3 pièces');,"Joli appartement au quatrième étage cuisine et salle de bain rénové   a côté de l école primaire, collège, mg , la postemetro et rfr a 10 mn  gaz de ville  titre de propriété   prix légèrement négociable');",105000.0,14/10/2024 21:50
1391,ariana,Vente,Appart. 1 pièce');,Riadh el andalous a  s1 ref376a agence immobilière kchaou met à la vente un joli appartement s1  dans une résidence bien située avec double ascenseur à riadh el andalous   composé de    un salon avec balcon   une cuisine ...');,165000.0,14/10/2024 21:18
1392,tunis,Vente,Appart. 2 pièces');,Appartement au centre ville le passage appartement à vendre  un appartement s + 2 retapé à neuf situé au centre ville le passage (superficie 95 m) au troisième étage (libre de suite)    description  - salon avec balcon <br/ ...');,145000.0,14/10/2024 20:59
1393,tunis,Vente,Appart. 1 pièce');,"Un superbe occasion à el manar 1 un superbe appartement s+1 situé dans le quartier prisé del manar 1. cet appartement, aux finitions de qualité, se compose de :    un grand salon-salle à manger lumineux    une cuisin ...');",240000.0,14/10/2024 18:58
1394,tunis,Vente,Appart. 2 pièces');,Appartement s2 au 3ème étage à l aouina cet appartement s+2 au 3ème étage se situe à l aouina. il est composé d un salon avec un balcon. une cuisine aménagée par des éléments de rangements et complétée par un séchoir. deux chambres à couche ...');,240000.0,14/10/2024 17:52
1395,tunis,Vente,Appart. 3 pièces');,Appartement s3 à ain zaghouan nord cette appartement s+3 situé à ain zaghouan nord. il se compose d un salon spacieux avec balcon. une cuisine aménagée par des éléments de rangements. elle est complétée par un séchoir. trois chambres à ...');,490000.0,14/10/2024 17:46
1396,tunis,Vente,Appart. 2 pièces');,Appartement s2 à ain zaghouan nord cette appartement s+2 situé à ain zaghouan nord. il se compose d un salon spacieux avec balcon. une cuisine aménagée par des éléments de rangements. elle est complétée par un séchoir. deux chambres à  ...');,477000.0,14/10/2024 17:44
1397,ben arous,Vente,Appart. 2 pièces');,Appartement s2 à medina jadida3 notre résidence el mouna 2 est située à nouvelle médina 3 rue de la république.  le mètre carré est à 2300 dt ttc.  nous disposons des appartements  s+2 de 116 à126m²  s+3 de140 à 149m ...');,291000.0,08/09/2023 11:57
1398,ben arous,Vente,Appart. 3 pièces');,S3 avec suite parentale notre résidence el mouna 2 est située à nouvelle médina 3 rue de la république.  le mètre carré est à 2300 dt ttc.  nous disposons des appartements  s+2 de 116 à126m²  s+3 de140 à 149m ...');,341000.0,08/09/2023 12:04
1399,ben arous,Vente,Appart. 3 pièces');,"Appartement s3 découvrez la résidence el mouna 2 à el medina el jadida 3, offrant des appartements s+2 et s+3 avec des superficies allant de 116m² à 149m², ainsi qu un rez-de-chaussée commercial comprenant des bouti ...');",338000.0,09/07/2024 15:54
1400,ben arous,Vente,Appart. 2 pièces');,Appartement s2 notre résidence el mouna 2 est située à nouvelle médina 3 rue de la république.  le mètre carré est à 2300 dt ttc.  nous disposons des appartements  s+2 de 116 à126m²  s+3 de140 à 149m ...');,272000.0,08/09/2023 11:54
1401,ben arous,Vente,Appart. 3 pièces');,Appartement avec suite notre résidence el mouna 2 est située à nouvelle médina 3 rue de la république.  le mètre carré est à 2300 dt ttc.  nous disposons des appartements  s+2 de 116 à126m²  s+3 de140 à 149m ...');,340000.0,06/07/2024 12:56
1402,ben arous,Vente,Appart. 3 pièces');,Gps appart s2 chauffé climatisé avec assenceur appartement à hammam chatt centger résidencxe panorama sur l avenue de la liberté coté essamba dee 86 m² avec deux balcons chambre des parents avec placard 2ém chambre avec placard cuisine agencée  te ...');,210000.0,22/08/2024 18:28
1403,ariana,Vente,Appart. 1 pièce');,Appartement s1    cit el ref69a just on time immo met à votre disposition un appartement s1 haut standing pour la vente à cité el ghazala ariana.   l?appartement se compose comme suit  un salon spacieux   une kitchennett ...');,215000.0,16/08/2024 12:44
1404,ben arous,Vente,Appart. 4 pièces');,Appartement 4 pièces rénové a vendre à mourouj 1 résidence chebbi (en face poste police)  un appartement rénové de 110 m2 en premier étage contenant :  un salon spacieux et lumineux (plus que 20m2) desservant un balcon f ...');,198000.0,14/10/2024 15:47
1405,tunis,Vente,Appart. 3 pièces');,Duplex s3 à la marsa cité el khalil ce duplex s+3 se situe dans une résidence d un quartier résidentiel à cité el khalil à la marsa. l entrée nous mène sur un salon assez spacieux avec un porte fenêtre. la cuisine est aménagée par des é ...');,650000.0,14/10/2024 15:45
1406,tunis,Vente,Appart. 4 pièces');,"Duplex ain zaghouan nord avenir immobilier met en vente à ain zaghouan nord un duplex au rdc de 190 mètre carré avec un jardin de 29 mètre carré, dans une résidence neuve haut standing. le duplex composé au rdc d un salon don ...');",860000.0,04/03/2024 11:52
1407,ariana,Vente,Appart. 4 pièces');,S3 directe promoteur darcom-tunisia la soukra vous mène à chotrana i et vous propose dacquérir un logement type s+3 directe promoteur en r+2 de standing.  la résidence est située i à proximité de laéroport et tous s ...');,495000.0,02/10/2024 17:54
1408,tunis,Vente,Appart. 2 pièces');,Apprt s1 a wahat enours de construction fb.6940  contacter notre conseillère en immobilière au 56306032   a vendre un appartement s1 encours de construction chez promoteur au 7 ème étage avec double ascenseurs à cité el wahat à coté ...');,181230.0,14/10/2024 12:52
1409,ben arous,Vente,Appart. 3 pièces');,Joli appartement  a rades foret un joli appartement s+3 sis au 2 éme étage à rades foret. vue panoramique et sans vis-à-vis avec un abri de voiture équipé d une porte basculante.pour plus d information contacter 26339269.');,175000.0,13/10/2024 20:51
1410,tunis,Vente,Appart. 2 pièces');,"Av appart s2 la marsa a vendre un appartement s+2 dans une résidence gardée à la marsa cité rabia .  détails, photos et visites    22471801');",310000.0,13/10/2024 19:57
1411,tunis,Vente,Appart. 4 pièces');,"Appartement 4 pièces cité olympique a vendre un bel appartement spacieux s+3, situé dans un quartier très calme, à proximité de toutes des commodités.    cet appartement bénéficie d un emplacement très stratégique: 15 minutes du ...');",245000.0,28/08/2024 21:50
1412,tunis,Vente,Appart. 2 pièces');,"Lumineux s 2 a ain zaghouan a vendre un coquet et magique appartement en s+2 très bien situé a ain zaghouan côté nestlé, proche de toutes les commodités.  3 ème étage avec ascenseur d une belle résidence sécurisée   prix ...');",265000.0,12/10/2024 15:57
1413,tunis,Vente,Appart. 3 pièces');,"Lo1600 appartement au rdc au kram réf : lo1600  a vendre un appartement s2 au rdc au kram   - salon, 2 chambres, salle de bain, cuisine équipée, terrasse de superficie 15 m²  - chauffage central,   - superficie de 70 m ...');",200000.0,12/10/2024 13:59
1414,ben arous,Vente,Appart. 3 pièces');,"Appart s3 catrine à ben arous appartement s 3 au 4e étage avec ascenseur, dans la résidence saraya, idéalement placée avec accès à toutes les commodités à ben arous. à lentrée, on a un spacieux salon avec balcon, une cuisine équi ...');",250000.0,12/10/2024 13:06
1415,tunis,Vente,Appart. 3 pièces');,Très luxueux appartement s2 au jardin de carthage l agence darek immobilière met en vente un très très luxueux appartement s+2 au jardin de carthage. cet apprt est situé dans un immeuble dont l architecture est très moderne à 5 min de carrefour   ...');,820000.0,26/10/2023 11:59
1416,ariana,Vente,Appart. 4 pièces');,Appartement s4 avec grande terrasse a vendre un superbe appartement s4 haut standing et bien spacieux avec terrasse au 2 ème étage d une résidence r2 sans ascenseur à la soukra près kiabi  l appartement se compose d un grand salon q ...');,780000.0,12/10/2024 12:19
1417,tunis,Vente,Appart. 4 pièces');,"Appart s3 opale à carthage salambo un appart à rénover situé au 2 éme étage dans un immeuble à carthage salambo. a l entrée, on a un salon, une cuisine avec séchoir, 3 chambres et une salle de bain. pour tous les renseignements, contac ...');",160000.0,30/09/2024 17:24
1418,ariana,Vente,Appart. 3 pièces');,"Appart s3 sedra à ariana un appart s3 au 3 éme étage  situé dans une résidence à ariana .  a lentrée, on a un grand salon avec balcon une cuisine , 3 chambres a coucher et une salle d eau. pour tous les renseignements, conta ...');",240000.0,11/10/2024 17:51
1419,ben arous,Vente,Appart. 2 pièces');,"Av ap s plus2 resid salma medina jadida3 ben arous a vendre appartement s+2 au 3ème étage, résidence salma, médina jadida 3, ben arous.   avec toutes les commodités sauf ascenseur, clôturé, place parking, gardée jour et nuit. 58474347');",140000.0,18/07/2024 17:32
1420,tunis,Vente,Appart. 2 pièces');,Apprt s1 à wahat encours de construction fb.6887  contacter notre conseillère en immobilière au 56306032  a vendre un appartement s1 encours de construction au 2ème étage avec ascenseur dans une résidence r+7 bien gardée et sécurisée ...');,185000.0,11/10/2024 14:20
1421,tunis,Vente,Appart. 4 pièces');,"Duplex à ebn sina tunis immobilière al amal vous propose;  a vendre duplex s+3 à ebn sina tunis près de toutes les commodités, qui fait le coin .  surface;130m²  dans un quartier résidentiel ( calme et propre) <b ...');",220000.0,11/10/2024 13:14
1422,ben arous,Vente,Appart. 3 pièces');,"Appart s2 kamila à la nouvelle médina un appartement au 2ème étage dans une résidence située à la nouvelle médina. à lentrée, on trouve un salon avec balcon, une cuisine avec séchoir, 2 chambres à coucher et une salle de bain. pour tous  ...');",190000.0,11/10/2024 13:11
1423,ariana,Vente,Appart. 2 pièces');,"Des appartements neufs à cité saha borj louzir a vendre des appartements neufs, de chez promoteur à cité saha - borj louzir , pas loin de carrfour market  s2 superficie : 126 m² prix : 240 milles   s3 superficie :  à partir 135 m²  prix :  ...');",240000.0,11/10/2024 12:29
1424,ariana,Vente,Appart. 3 pièces');,Immeuble titres immeuble de six appartement presque finis');,1800000.0,23/09/2024 15:59
1425,ariana,Vente,Appart. 3 pièces');,Appartement s3 de bon standing à la soukra a vendre un superbe appartement s3 de bon standing au 1 er étage d une résidence avec double ascenseur à la soukra en face du parc soukra et derrière silver mall  l appartement se compose d un sal ...');,398000.0,11/10/2024 12:20
1426,ariana,Vente,Appart. 3 pièces');,"Appartement s3 comme neuf à chotrana 1 a vendre un bel appartement s3 au 2 éme étage dans une résidence r2 avec ascenseur à chotrana 1  composition   salon , terrasse , 2 chambres à coucher , suite parentale , cuisine équipée , séc ...');",550000.0,11/10/2024 12:07
1427,tunis,Vente,Appart. 2 pièces');,"Appartement s2 dans une residence la méditerranée immobilière bardo vous propose à la vente un appartement en s2 dans une résidence sécurisée et proche de toutes les commodités à bardo. ce dernier est composé dun salon avec balcon ,  ...');",250000.0,29/08/2024 15:00
1428,ariana,Vente,Appart. 2 pièces');,Appartement s2 comme neuf à chotrana 1 un superbe #appartement s+2 haut standing au rez de chaussé d une résidence r+2 avec ascenseur récemment construire à lotissement bouchamaoui #chotrana 1  l appartement se compose d un salon qui d ...');,380000.0,11/10/2024 11:54
1429,tunis,Vente,Appart. 3 pièces');,"Appartement s3 au bardo 2 agence la méditerranée met à la vente un appartement s3 au bardo situé dans un quartier calme et sécurisée il se compose d  un salon avec balcon , une cuisine équipé par des éléments de rangement , tr ...');",200000.0,29/08/2024 14:53
1430,tunis,Vente,Appart. 2 pièces');,"Appartement s2 1er étage d une résidence à aouina l appartement se compose d un salon , une cuisine équipée d une hotte aspirante, une plaque chauffante et aménagée par des éléments de rangement.   les deux chambre à coucher avec dressing et part ...');",377000.0,19/09/2024 16:16
1431,tunis,Vente,Appart. 3 pièces');,"Appartement spacieuse agence la méditerranée met à la vente un appartement s3 au bardo situé dans un quartier calme et sécurisée il se compose d  un salon avec balcon , une cuisine équipé par des éléments de rangement , tr ...');",260000.0,29/08/2024 14:45
1432,ariana,Vente,Appart. 2 pièces');,"Appartement s2 avec grand jardin et piscine a vendre un superbe appartement s2 avec grand jardin et piscine, luxueux et très haut standing au rez de chaussée d une résidence r2 avec ascenseur à chotrana   place parking sous sol disponible.  ...');",680000.0,11/10/2024 11:50
1433,ariana,Vente,Appart. 1 pièce');,"Appartement s1 avec grande terrasse à chotrana 1 a vendre  un appartement s1 au rdc à chotrana 1 dans une résidence r2   composition   salon , chambres à coucher , salle de bain et cuisine  bien équipée ( plaque , hotte , 2 four électrique , ...');",330000.0,11/10/2024 11:45
1434,ariana,Vente,Appart. 3 pièces');,"Superbe appartement s3 à nkhilette a vendre un superbe appartement s3 totalement rénové, de très haut standing au 1 er étage d une résidence avec #ascenseur à #nkhilette   l appartement se compose d un grand salon avec balcon, cuis ...');",295000.0,11/10/2024 11:29
1435,tunis,Vente,Appart. 4 pièces');,"Rdc de villa ceyla à casino la goulette un rdc de villa avec une entrée indépendante sur un terrain de 300 m2 situé dans un quartier résidentiel côté mer à casino, la goulette. a l entrée, on a un salon, salle à manger, une grande cuisine,  ...');",500000.0,11/10/2024 11:17
1436,ariana,Vente,Appart. 2 pièces');,"Appartement s2 à cité béhi ladghem a vendre un appartement s2 au rdc  à cité saha  behi ladghem   composition : salon , 2 chambres à coucher , cuisine , salle de bain et abri de voiture   superficie :79m²   prix : 128 mille ...');",128000.0,11/10/2024 11:14
1437,tunis,Vente,Appart. 2 pièces');,Apprtement  s1 a wahat fb.6907  contacter notre conseillère en immobilier au 56306032  a vendre un appartement s1 encours de construction dun superficie 66m et un terrasse de 8.5 au 4éme au 5éme étage avec double a ...');,260000.0,11/10/2024 11:12
1438,tunis,Vente,Appart. 5 pièces+');,"Immeuble yosef au kram ouest un immeuble sur un terrain de 75 m² situé dans un bon quartier à kram ouest. au rdc, on a un salon, une cuisine et une salle de bain. au 1er étage, on trouve un appart s3 qui se compose par un salon,  ...');",140000.0,11/10/2024 10:53
1439,ariana,Vente,Appart. 2 pièces');,"Appartement s2 à l ariana a vendre un appartement s2  au 2 éme étage d une résidence r3 à ariana.  l appartement se compose d un salon avec balcon, cuisine équipée, salle d eau, deux chambres à coucher et une salle de bain ...');",189000.0,11/10/2024 10:49
1440,tunis,Vente,Appart. 2 pièces');,"Appart s2 rosie centre ville tunis un appart s2 au  2ème étage situé dans une résidence à centre ville tunis. a l entrée, on trouve un salon avec balcon, une cuisine équipée, deux chambres à coucher et une salle de bain. pour tous les  ...');",190000.0,11/10/2024 10:45
1441,tunis,Vente,Appart. 3 pièces');,"Appartement s3 spacieux à cité wahat a vendre un superbe appartement s+3 au 3 éme étage  d une résidence r+6 avec ascenseur  à zayatine - l aouina   composition  salon , 3 chambres à coucher ,cuisine équipée , séchoir ,  salle d  ...');",430000.0,11/10/2024 10:31
1442,tunis,Vente,Appart. 2 pièces');,"Appartement s2 neuf à cité wahat a vendre un superbe appartement s2 au 4 ème étage avec ascenseur à cité wahat prés ben yaghlen et carrefour market.  l appartement se compose d un grand salon , cuisine spacieuse très bien équipée ...');",357000.0,11/10/2024 10:24
1443,ben arous,Vente,Appart. 3 pièces');,Zone  calme profiter à vendre  pour l investissement ou habitation apparemment  rdc a mourouj 5 dans une residence calme   et sécurisée     2chambre  cuisine avec séchoir   salle de bain    gaz de ...');,125000.0,11/10/2024 06:49
1444,ben arous,Vente,Appart. 2 pièces');,S1au 3eme etage avec ascenseur agence immobilière propose à vendre appartement 62 m²   s+1 au 3 ème étage avec ascenseur   salon + chambre à coucher + salle de bain + cuisine + séchoir   à hammam lif  près station métro ...');,105000.0,10/10/2024 23:07
1445,manouba,Vente,Appart. 3 pièces');,Appartement sprols un appartement s+3 dans une résidence calme sprols mannouba proche des commodités de vie .  prix négociable pour plus d info merci de contacter 20684555');,2050000.0,10/10/2024 23:00
1446,ariana,Vente,Appart. 3 pièces');,Résidence neuf à chotrana 1 des appartements neufs modernes situés dans une résidence r2 de haut standing implantée à chotrana i à proximité de laéroport et tous services.      s2 de 117 m² avec terrasse 19 m à  par ...');,460000.0,15/07/2024 13:55
1447,ariana,Vente,Appart. 3 pièces');,Des appartements soukra neuf des appartements neufs modernes situés dans une résidence r2 de haut standing implantée à chotrana i à proximité de laéroport et tous services.    s2 de 117 m et 19 m de terrasse à 460.000 dt ...');,460000.0,23/07/2024 13:22
1448,tunis,Vente,Appart. 5 pièces+');,"S4 jardin de carthage darcom tunisia vous a décroché une opportunité dun s4 de haut standing, en excellent état, lumineux et spacieux, dune superficie de 202 m, offrant une vue dégagée imprenable et est situé dans une ré ...');",780000.0,29/08/2024 12:25
1449,tunis,Vente,Appart. 5 pièces+');,App bureatique 3 eme etage vente app. bureatque compose de cinq bureaux identique + salle d eau + kitchinette situé au 3eme etage immeuble 31 rue d italie - tunis ( croisement rue houcine bouzaienne et rue d italie ) près du pl ...');,300000.0,10/10/2024 16:02
1450,ariana,Vente,Appart. 4 pièces');,"S3 neuf la soukra appartement s3 neuf et moderne sis dans une résidence r2 dotée dun bon emplacement à chotrana i.    l appartement s3 se composent comme suit : un salon spacieux qui donne sur un balcon , un d ...');",527000.0,04/09/2024 14:41
1451,ariana,Vente,Appart. 5 pièces+');,"S4 avec jardin à chotrana 1 une opportunité dun s4 de haut standing, en excellent état, lumineux et spacieux, dune superficie de 210 m, offrant une vue dégagée sur un jardin  de 37.9 m   imprenable et est situé dans une réside ...');",650000.0,29/08/2024 12:18
1452,ariana,Vente,Appart. 3 pièces');,Des s1 et s2 a la soukra projet immobilier r2 de haut standing composé dappartements de type s1 et s2 seulement situé dans un emplacement privilégié à la soukra-chotrana i.    remise des clés  aout 2024    re ...');,245000.0,29/08/2024 12:06
1453,tunis,Vente,Appart. 2 pièces');,Apprt encours de construction à   wahat fb.6348  contacter notre conseiller en immobilier au 56306032  a vendre un appartement s+2 encours de construction à cité wahat dans une résidence r7 gardé et securisé proche de toute commodit ...');,244950.0,10/10/2024 13:19
1454,tunis,Vente,Appart. 3 pièces');,"Apprt encours de construction à jardins aouina fb.6653  contacter notre conseillère en immobilière au 56306032   a vendre un appartement s2 encours de construction chez promoteur à jardins de laouina , il se compose d un   salon <br/ ...');",284850.0,10/10/2024 12:39
1455,ariana,Vente,Appart. 3 pièces');,"S2 ariana ville à vendre un appartement s+2 aux 4 e étage d une résidence r+4 à l  ariana près de hôpital mahmoud el matri ariana, composé d un salon, cuisine bien équipée, sdb, deux chambres, la résidence est bien s ...');",180000.0,10/10/2024 12:21
1456,ariana,Vente,Appart. 4 pièces');,"S3 hs menzah8 a vendre un appartement de 160 mc net s3 au 4 eme étage avec ascenseur et place de parking au sous sol composé de suite parentale ssm cuisine très bien équipée , buanderie chambre de service 2 chambre ...');",460000.0,19/09/2024 19:50
1457,tunis,Vente,Appart. 1 pièce');,Appartement  cite wahat au 2eme etage s1 notre agence le palais  met a la vente  un appartement  s1 au 2éme étage jamais habité  avec ascenseur  dans  une résidence gardé    située :  cité wahat  composé de :    salon  <b ...');,19000.0,10/10/2024 11:46
1458,tunis,Vente,Appart. 1 pièce');,A  local commercial ref794a l?agence immobilière tunisie bnb propose à la vente un local commercial de 40 m² situé au rez-de-chaussée offre un espace spacieux et polyvalent idéal pour accueillir diverses activités commerciales.  ...');,220000.0,10/10/2024 11:44
1459,tunis,Vente,Appart. 4 pièces');,"Appartement s3 aouina a vendre un appartement s3 a l aouina au 4 eme étage avec ascenseur dans une résidence sécurisé pres de toutes commodités composé d un salon avec balcon cuisine équipée , séchoir , 3 ch avec dressing  ...');",350000.0,08/09/2024 14:33
1460,tunis,Vente,Appart. 4 pièces');,S3 à l aouina tunis a vendre un appartement au 4 eme étage avec ascenseur place de parking au sous sole et cellier composé d un salon cuisine séchoir 3 chambres avec dressing sdb et sd contact ag 98 439 909');,350000.0,19/09/2024 19:56
1461,tunis,Vente,Appart. 4 pièces');,"Appartement a vendre un appartement s+3 au rez-de-chaussée d un immeuble dans une résidence gardée et clôturée comprenant toutes les commodités(eau, électricité, téléphone, gaz de ville et chauffage central) avec ...');",170000.0,04/07/2024 14:17
1462,ariana,Vente,Appart. 3 pièces');,"Appart s2 sibel à ennasr 2 un coquet appart au 6ème et derrière étage situé dans une résidence avec double ascenseur à ennasr 2. a l entrée, on a un grand salon avec balcon, une cuisine avec séchoir, 2 chambres et une salle de  ...');",290000.0,10/10/2024 11:32
1463,ariana,Vente,Appart. 2 pièces');,Appartement s1 neuf à chotrana 1 découvrez ce splendide appartement s1 situé dans une résidence de deux étages nouvellement construite à chotrana  profitez de l emplacement exceptionnel doté d un accès direct aux grands axes de c ...');,244000.0,10/10/2024 11:17
1464,tunis,Vente,Appart. 3 pièces');,"Appartement s2 route gammarth appartement route gammarth : contact 95404051 ou 7232600   immobilière maximum propose à la vente dans une agréable résidence r2 route de gammarth, un appartement s2 au 1 er étage, 91 m² ,bien ent ...');",315000.0,17/07/2024 15:00
1465,tunis,Vente,Appart. 4 pièces');,Duplex jamais habité à vendre un duplex s+3 direct promoteur  190m2  à jardin de carthage  pour plus de photos veillez visiter notre page fb agence service immo  28 38 12 12');,780000.0,10/10/2024 09:42
1466,tunis,Vente,Appart. 4 pièces');,Duplex direct promoteur à vendre un duplex s+3 direct promoteur    190m2  à jardin de carthage   pour plus de photos veillez visiter notre page fb agence service immo  28 38 12 12');,780000.0,10/10/2024 09:38
1467,tunis,Vente,Appart. 3 pièces');,3 pièces aux jardins de carthage un 3 pièces de 115m2 de haut standing (année 2019) dans une résidence gardée et sécurisée (proche du siège de la banque zitouna).    il se compose de:  - un salon revêtu en marbre avec acc ...');,440000.0,09/10/2024 18:27
1468,tunis,Vente,Appart. 2 pièces');,Apprt encours de construction à wahat fb.6348  contacter notre conseiller en immobilier au 56306032  a vendre un appartement s+2 encours de construction à cité wahat dans une résidence r+7 gardé et securisé proche de toute commodi ...');,244950.0,09/10/2024 17:57
1469,tunis,Vente,Appart. 3 pièces');,Apprt s2 à ain zaghouen sud fb.5434  contacter notre conseiller en immobilier au 56306032  a vendre un appartement s+2 dans une résidence r2 au 2éme étage sans ascenseur dans résidence gardée et bien sécurisé à ain zagho ...');,300000.0,09/10/2024 17:43
1470,ariana,Vente,Appart. 3 pièces');,Apprt splus 2 à la soukra prés golf center fb.6697  contacter notre conseiller en immobilier au 56306032   a vendre une appartement s+2 2éme étage avec ascenseur suitée à la soukra prés du golf centre dans une résidence bien gardée et  ...');,370000.0,09/10/2024 17:32
1471,ariana,Vente,Appart. 2 pièces');,Apprt s1 au 1ér étage fb.6727  a vendre un appartement s1 au 1ér étage sans ascenseur à soukra il se compose   salon  chambre à coucher  salle de douche  cuisine  climatiseur  titre  contact ...');,145000.0,09/10/2024 16:38
