,Gouvernorat,Nature,Type,Description,Price,Insertion Date
0,tunis,Vente,Appart. 2 pièces');,S plus 1 cite el wahat tel 58258423 fb6935 contacter notre conseillère en immobilière au 58258423 56096179 70727279.  a vendre un appartement s plus 1 chez promoteur au 7 ème étage avec double ascenseurs à cité el wahat à coté carrefour à  ...');,190000.0,14/11/2024 12:26
1,tunis,Vente,Appart. 2 pièces');,S plus 1 cite el wahat tel 58258423 fb6935 contacter notre conseillère en immobilière au 58258423 56096179 70727279.  a vendre un appartement s plus 1 chez promoteur au 7 ème étage avec double ascenseurs à cité el wahat à coté carrefour à  ...');,190000.0,14/11/2024 12:26
2,ben arous,Vente,Appart. 3 pièces');,Appartement nawres agence immobilière elkarama met en vente un appartement  2 étage qui se compose d un salon deux chambres coucher  cuisine équipée salle de bain  balcon place parking  sans ascenseur  situé mourouj 5 p ...');,107000.0,24/08/2024 19:18
3,tunis,Vente,Appart. 4 pièces');,"S plus 3 a el manar 1 wb3822 l agence immo contact met en vente a el manar 1 ( pas tres loin de rapid poste )  pour 245000 dt un s plus 3 (90m) avec chauffage central , salle de bain , salle d eau , vue panoramique , parking exté ...');",245000.0,27/11/2024 11:15
4,ariana,Vente,Appart. 3 pièces');,Des s2 neufs à la nouvelle soukra agence immobilière vous propose à la vente un appartement s+2 neuf dune superficie de 96.15m² situé au 2ème étage  dune résidence en r+4 avec double ascenseur en cours dexécution à la nouvelle souk ...');,330000.0,18/07/2024 13:18
5,tunis,Vente,Appart. 5 pièces+');,Viila bhar lazra9 bhar lazri9 a vendre une villa indepandante de terrain 150 m2   rue chausse s+3 avec etage s+3 + un studio s+1   tire bleu   quartierpropre   contacter lagent samir 25 093994');,300000.0,11/10/2024 10:38
6,tunis,Vente,Appart. 5 pièces+');,Viila bhar lazra9 bhar lazri9 a vendre une villa indepandante de terrain 150 m2   rue chausse s+3 avec etage s+3 + un studio s+1   tire bleu   quartierpropre   contacter lagent samir 25 093994');,300000.0,11/10/2024 10:38
7,tunis,Vente,Appart. 3 pièces');,"Un appartement luxueux s2 à el menzah 9c a vendre un appartement luxueux s+2 à el menzah 9c  .  a vendre un appartement luxueux s+2 à el menzah 9c , dans une résidence très agréable , lappartement est spacieux , composé dans sa partie j ...');",395000.0,07/11/2024 12:46
8,tunis,Vente,Appart. 3 pièces');,S plus 3 cite wahat pres aziza fb.6807  contacter notre conseillère en immobilier au 58713586 / 56096179 / 70727279.  a vendre un appartement s+3 au rdc dans une résidence bien sécurisée et bien gardée .il se compose dun s ...');,270000.0,14/09/2024 15:15
9,ariana,Vente,Appart. 2 pièces');,"Bel appartement titré enkhilet vaa 010  a vendre à enkhilet un bel appartement s+2 de haut standing avec titre foncier individuel, situé au rez de chaussée dune résidence gardée et sécurisée, accès rapide et proche de toutes c ...');",210000.0,24/11/2024 15:31
10,ariana,Vente,Appart. 3 pièces');,Appartement s2 à jardin d l menzah1 a vendre un appartement s2 situé jardin d el menzah1 bien entretenu mais sans ascenseur  il se compose   -d un spacieux salon salle à manger agréable avec balcon  -deux grandes chambres à  ...');,250000.0,16/10/2024 16:07
11,ariana,Vente,Appart. 2 pièces');,"Appartement titré cité la gazelle vag 002  a vendre à cité la gazelle un bel appartement s+2 avec titre foncier individuel, situé au 5ème étage dune résidence gardée et sécurisée avec ascenseur codé, accès rapide et proche de tou ...');",255000.0,24/11/2024 13:39
12,ariana,Vente,Appart. 3 pièces');,"Appartement s3 soukra nous mettons a la vente un appartement s+3 a la soukra de 165m² haut standing situé au dernier étage dune résidence r+2, calme et sécurisée.     lappartement se compose dun vaste salon avec ...');",520000.0,12/11/2021 18:15
13,ariana,Vente,Appart. 5 pièces+');,"Bel et grand appartement ennasr 2 van 024  a vendre à ennasr 2 un bel appartement s+4 spacieux avec titre foncier individuel, dune superficie de 205 m² avec une grande terrasse de 120 m² situé au troisième étage d une belle  rési ...');",600000.0,10/01/2024 13:54
14,ariana,Vente,Appart. 2 pièces');,Av projet neuf s1 s2 après la vente intégrale de la 1ère tranche : acsimmo met en vente la deuxieme tranche d un projet en cours de construction à la soukra des appartements en s+1 à partir 275 md et s+2 à partir de 455 m ...');,275000.0,21/11/2024 10:52
15,ariana,Vente,Appart. 3 pièces');,Appart s3 3éme étage  ariana africa mall 170milles lagence sicile immo  vous propose pour la vente  d un appartement s3 au 3ère étage   sécurisé situé à ariana africa mall   offre:   3chambre     cuisine équipée      une salle de bain ...');,170000.0,27/11/2024 10:42
16,tunis,Vente,Appart. 3 pièces');,S plus deux haut standing à l aouina a vendre un bel appartement s plus deux situé dans une résidence calme et bien gardée avec deux ascenseurs à la nouvelle soukra l aouina.  lappartement est composé d un salon donnant sur un balco ...');,245000.0,13/11/2024 13:20
17,ben arous,Vente,Appart. 4 pièces');,"Appartement mourouj 3 2 étage agence immobilière elkarama met  en vente un bel appartement s 3  2eme   étage situé dans une résidence  au mourouj  3 bien sécurisée et près de toutes  commodités  collège rachidia  monoprix , métro  ...');",170000.0,08/06/2024 15:30
18,ben arous,Vente,Appart. 3 pièces');,Appartement saif agence el karama met en vente un appartement s+2 à mourouj 1.  2éme étage   salon   deux chambres à couchée   cuisine   salle d eau   balcon   pour plus d information et po ...');,140000.0,13/12/2023 17:47
19,tunis,Vente,Appart. 1 pièce');,Apprt splus 2 à cité el wahat fb.7092  contacter notre conseillère en immobilière au 56306032 / 56096179 / 70727279.  a vendre un appartement s+2 avec double ascenseurs dans une résidence bien gardée et sécurisée à cité el ...');,263610.0,27/11/2024 10:20
20,ariana,Vente,Appart. 5 pièces+');,S4 spacieux et lumineux a ennasr 2 met à la vente un appartement s+4 de 230 m2 au 5 éme etage  avec double ascenseur dans une résidence sécurisée et proche de toutes  commodités  .      il se compose d:    -un salon sa ...');,700000.0,10/11/2024 15:12
21,ariana,Vente,Appart. 3 pièces');,"Duplex a la menzah 6 s+3 se compose d un sous sol 1er étage chambre d amis au rez de chaussée salon ,salle a manger , cuisine et salle de bain avec grand terasse   2eme étage chambre parents chambre d enfants salle de ...');",550000.0,24/10/2024 12:33
22,ben arous,Vente,Appart. 3 pièces');,"Appartement s3 hst ezzahra a vendre à ezzahra, un appartement s+3 de 175m2 , composé dun grand salon avec un balcon, une cuisine équipée, une salle de bain , une salle deau et trois chambres à coucher dont deux avec un dressi ...');",330000.0,12/07/2024 11:16
23,ben arous,Vente,Appart. 1 pièce');,Rdc s1 médina jadida a vendre appartement s+1 rdc  à médina jadida   composition :  salon avec balcon   chambre à coucher   cuisine avec séchoir   salle d eau avec douche  prix:80mille  pour pl ...');,80000.0,25/11/2024 09:09
24,ben arous,Vente,Appart. 2 pièces');,Av s2 avec place parking sous sol médina jadida 3 a vendre haut standing appartement de type s+2 avec place parking sous sol à médina jadida 3  composition   salon climatisé avec balcon   suite parentale(cabine douche )climatisé   cha ...');,250000.0,15/11/2024 09:22
25,ariana,Vente,Appart. 5 pièces+');,S4 360 md a ennasr 1 appartement s+4  à vendre    helma immobilière vous propose a la vente un appartement s+4 de 190 m2 au 6 ème etage avec double ascenseur dans une résidence gardée et sécurisée proches de toute ...');,360000.0,19/11/2024 06:56
26,ariana,Vente,Appart. 3 pièces');,S2 enkhilete 210 md on vous propose a la vente un appartement s+2 de 105 m2 au  rez-de-chaussée dans une résidence gardée et sécurisée proches de toutes commodités.    il se compose d :    - un salon <br/ ...');,210000.0,21/11/2024 14:55
27,ariana,Vente,Appart. 4 pièces');,S3 335 md ghazela appartement s+3 à vendre    helma immobilière vous propose a la vente un appartement s+3 de 144 m2 au  4 ème etage avec ascenseur dans une résidence gardée et sécurisée proches de toutes commo ...');,335000.0,19/11/2024 07:02
28,ben arous,Vente,Appart. 2 pièces');,"Appartement s2 hst à rades a vendre à rades meliane, un appartement s+2 très spacieux, composé d un salon avec balcon, une cuisine totalement équipée ,un hall avec un grand dressing , deux chambres à coucher et une salle de bai ...');",280000.0,04/10/2024 11:28
29,tunis,Vente,Appart. 4 pièces');,Appartement s3 jamais habité à la soukra à vendre  appartement s+3 à la soukra  superficie: 185 m²  etage: 2 ème étage avec ascenseur.  composition:  salon avec balcon .  salle deau invité.   cuisine équipée de h ...');,590000.0,17/05/2024 12:49
30,tunis,Vente,Appart. 2 pièces');,Appartement s1 avec jardin à la marsa à vendre  appartement s1 avec jardin à la marsa  emplacement : cité riadh  superficie : 60 m²  étage : rez-de-chaussée  composition :  salon  cuisine ouverte équipée de pla ...');,185000.0,02/10/2024 18:26
31,ben arous,Vente,Appart. 4 pièces');,"Triplex ezzahra a vendre à ezzahra , un triplex s+4 moyen standing, composé au rez-de-chaussée dun grand salon, une cuisine avec éléments et une salle deau, au 1er étage on trouve trois chambres à coucher et une sa ...');",300000.0,20/06/2024 12:14
32,tunis,Vente,Appart. 5 pièces+');,Appartement s plus 4 à alain savary sweet home vous propose à la vente un appartement s+4 titré  d une superficie 165 m² à alain savary  (côté municipalité el khadra) situé au 6éme étage d une résidence calme et sécurisée avec double as ...');,385000.0,31/10/2024 13:52
33,tunis,Vente,Appart. 2 pièces');,Appartement cité mahrajene appartement s+2 approximité rapide poste au 4eme étage sans assenceur se compose d un salon salle a manger chambre parents chambre d enfants cuisine salle de bain .');,270000.0,24/10/2024 13:02
34,tunis,Vente,Appart. 3 pièces');,"Manar 1 s3 de 90m2 proche campus monoprix clinique à vendre à manar 1 direct propriétaire, s+3 de 90m2 moyen standing à côté du campus, monoprix et de la clinique, idéal famille ou investissement locatif ( étudiants) s+3 , cuisine avec séchoir. salle  ...');",234000.0,27/11/2024 09:26
35,tunis,Vente,Appart. 4 pièces');,Duplex a la marsa duplex a vendre a la marsa s+4 se compose d un salon salle a manger cuisine et salle de bain   1er étage un suite parental avec dressing et salle de bain 3 chambres d enfants avec salle de bain  < ...');,550000.0,24/10/2024 12:20
36,manouba,Vente,Appart. 3 pièces');,Premier étage propre à el 3agba on vend un appartement propre de salon plus  deux chambres plus cuisine plus salle d eau avec douche  plus deux placards.  les papiers en règles.  bon prix: 48 milles dinars ...');,50000.0,24/09/2024 01:02
37,tunis,Vente,Appart. 3 pièces');,Appartement s2 avec une terrasse direct promoteur agence immobilière le carré 9 vous propose à la vente un appartement s+2  neuf direct promoteur dune superficie de 177.5m² situé au 3éme étage dune  résidence gardée et sécurisée  avec double ascens ...');,675000.0,13/12/2023 10:24
38,tunis,Vente,Appart. 3 pièces');,S plus 3 aouina wahat fb.7008    contacter notre agent en immobilier au 51004658 / 56096179 / 70727279    a vendre un appartement s+3 situé au 3ème étage avec ascenseur dans une résidence bien gardée et séc ...');,350000.0,30/10/2024 12:41
39,tunis,Vente,Appart. 2 pièces');,"S plus 2 direct promoteur fb.6184    contacter notre conseillère en immobilière au 51004658 / 56096179 / 70727279.    a vendre un appartement s+2 hts neuf au 4éme étage à cité wahat, il se compose d un salon a ...');",355000.0,30/09/2024 12:44
40,tunis,Vente,Appart. 3 pièces');,S plus 3 wahat aouina fb.6695    contacter notre conseiller en immobilier au 51004658 / 56096179 / 70727279    a vendre un appartement s+3 au 2éme étagede haut standing avec double ascenseurs à cité el waha ...');,390000.0,19/08/2024 15:59
41,ariana,Vente,Appart. 3 pièces');,S2 ghazela 275 md on  vous propose a la vente un appartement s+2 de 114 m2 au  5 ème etage avec ascenseur dans une résidence gardée et sécurisée proches de toutes commodités.    il se compose d :    -   ...');,275000.0,21/11/2024 14:51
42,ariana,Vente,Appart. 4 pièces');,S3 avec jardin à ennasr 2 appartement s+3 spacieux avec jardin ennaser     helma immobilière vous propose a la vente un appartement s+3 de 189 m2 standing au rez de chaussée avec jardin et  abri de voiture dans une rés ...');,475000.0,26/11/2024 15:12
43,tunis,Vente,Appart. 1 pièce');,Opportunite s plus 1 a jardins de carthage fb.7062  contacter notre conseiller en immobilière au 58713586 / 56096179 / 70727279.  a vendre un appartement s+1 dans une résidence bien gardée et sécurisée à jardins de carthage (residence  ...');,320000.0,15/11/2024 10:52
44,tunis,Vente,Appart. 2 pièces');,S plus 2 rsd hôtelière jardins de carthage fb.6078  contacter notre conseillère en immobilier au 58713586 / 56096176 / 70727279.  à vendre un appartement s+2 haut standing jamais habitée situé au 1ère étage dans une residence de luxe a ...');,540000.0,16/10/2024 14:54
45,tunis,Vente,Appart. 4 pièces');,S plus 4 cite el wahat pres aziza fb.6505  contacter notre conseillère en immobilier au 58713586 / 56096179 / 70727279.  a vendre un appartement s+4 situé au 2éme étage avec ascenseur dans une résidence bien sécurisée et bien  ...');,365000.0,15/11/2024 10:57
46,ariana,Vente,Appart. 3 pièces');,"Soukra parc vnt s2 110m2 on vous propose à la   vente à  la #soukrapark, un  spacieux s2 de 110 m2 , au deuxième (02)  étage   avec  double  ascenseur.     appartement en haut standing     chauffage central, c ...');",360000.0,23/10/2024 18:15
47,tunis,Vente,Appart. 3 pièces');,"Cite el khadra vnt s2 rdc je mets en vente à #cité-el khadra, près de la mosquée,  un   s+2 de  100 m2, au rdc.    appartement bien orienté charky, et ouvre sur le jardin de la résidence  cuisine refaire et équipée ...');",220000.0,14/11/2024 09:13
48,tunis,Vente,Appart. 3 pièces');,"Appartement de type s3 à gammarth si vous cherchez un appartement à vendre à gammarth, arcane immobilière vous propose en exclusivité ce joli bien immobilier en excellent état en mesure de répondre à toutes vos attentes.  cet appa ...');",790000.0,26/09/2024 17:15
49,tunis,Vente,Appart. 3 pièces');,"Duplex haut standing à gammarth si vous cherchez un appartement à vendre à gammarth, arcane immobilière vous propose en exclusivité ce joli bien immobilier en excellent état en mesure de répondre à toutes vos attentes.  cet appa ...');",910000.0,26/09/2024 17:08
50,ariana,Vente,Appart. 3 pièces');,App s3 à ariana borj louzir agence immobilière 100 s immo vous propose pour la vente un appartement 115 m² sis à ariana borj louizir au 4ème étage dans une #résidence sécurisée et proche de toutes commodités à 2 minutes de l aér ...');,135000.0,03/10/2023 15:55
51,ben arous,Vente,Appart. 4 pièces');,"Villa ezzahra ville a vendre une villa à ezzahra ville, près de toute commodités, à 150 m de la plage.   d une superficie de 620 m2 sur laquelle est érigée une vieille bâtisse d environ 105 m2 en pierre. elle fait le ...');",820000.0,05/08/2024 10:04
52,ariana,Vente,Appart. 4 pièces');,"Splus3 la soukra on met en vente un joli appartement  s+3 à la soukra    l appartement se trouve dans un quartier chic et résidentiel, proche de toutes commodités  il se compose d un salon avec balcon , une su ...');",490000.0,24/04/2024 13:19
53,ariana,Vente,Appart. 4 pièces');,S3 a ennasr 1 avec jardin appartement s+3  à vendre    helma immobilière vous propose a la vente un appartement s+3 de 145 m2 et 70 m2  au  rez-de-chaussée avec une entrée indépendante dans une résidence en r+2 gardée  ...');,500000.0,28/10/2024 21:31
54,ariana,Vente,Appart. 2 pièces');,S1 180 md aux jardins del menzah 1 appartement s+1 a vendre    on  met à la vente un appartement  s+1 au 2 eme étage de 50 m2 dans une résidence gardée et sécurisée proches de toutes commodités.     il se compose d: <b ...');,180000.0,26/11/2024 15:06
55,ben arous,Vente,Appart. 4 pièces');,"S plus 3 très bien ensoleillé je vends mon appartement au deuxième étage de 3 pièce et un salon avec un grand balcon et un clim, le est vraiment très bien ensoleillé, cuisine avec séchoir très bien équipé, salle de bain et une sal ...');",175000.0,27/11/2024 00:41
56,ariana,Vente,Appart. 2 pièces');,"S1 175 md aux jardins del menzah 2 appartement s+1 a vendre    helma immobilière met à la vente un appartement  s+1 de 50 m2 aux rez-de-chaussée dans une résidence gardée et sécurisée proches de toutes commodités  monoprix,  ba ...');",175000.0,26/11/2024 14:35
57,tunis,Vente,Appart. 3 pièces');,"S2 380 md menzah 9c on met à la vente un appartement s+2 de 114 m², au 2ème étage, avec double ascenseurs dans une résidence gardée et sécurisée    il se compose :      - salon avec balcon    - cuisin ...');",380000.0,26/11/2024 20:36
58,ben arous,Vente,Appart. 3 pièces');,Coquette  appartement a hammam hat av appartement a troisième étage avec encenseur cartier calme 3 minute a la gare et 3 minute a la plage se compose 2 chambre 2 chambres +salon +sale de bain +cuisine bien équipée  +2 balcon +abri de v ...');,170000.0,08/04/2024 08:46
59,ben arous,Vente,Appart. 4 pièces');,Luxueux  appartement meubler av appartement haut standing  meubler minute a la gare de train  riath a deuxième étage en belle emplacement chic et calme superficie 170² se compose 3 chambres avec les placard  +salon +cuisine bien  ...');,250000.0,07/02/2024 07:57
60,tunis,Vente,Appart. 2 pièces');,8 appartements à la marsa ettabek a vendre une petite résidence de 8 appartements en s+2 meublé à la marsa cité ettabek pour plus d information veuillez contactez l agence immobilière sur le 28167167');,2500000.0,23/04/2024 10:55
61,ariana,Vente,Appart. 3 pièces');,"Borj louzir  vnt s2 ketata immo met en vente à borj louzir cité béhi ladghem, un appartement s+2 de 80 m2.    l appartement se trouve au troisième (3) étage sans ascenseur.    moyen standing.    a ...');",120000.0,26/06/2024 09:15
62,tunis,Vente,Appart. 3 pièces');,"Cite el hadika vnt s2 #cité.el.hadika, vente d un s+2, 100 m2    on vous propose à la   vente à  cité.el.hadika, un  s2 de 100 m2 , au deuxième (02)  étage   sans ascenseur.     appartement bien orienté, tr ...');",185000.0,26/11/2024 18:02
63,tunis,Vente,Appart. 4 pièces');,"Apprt s3 avec 2 places parkings fb.6807  contacter notre conseillère en immobilier au 56306032  a vendre un appartement s+3 au rdc dans une résidence bien sécurisée et bien gardée .il se compose dun salon , cuisine équipée  ...');",270000.0,26/11/2024 17:26
64,ariana,Vente,Appart. 2 pièces');,Appartement s2 de 75m2 a borj louzir emplacement : behi ladghem.  superficie : 75 m².  etage : 2éme étage.  typologie : s2.    composition :  salon avec balcon.  cuisine équipée de hotte et plaque.  deux c ...');,145000.0,26/11/2024 17:19
65,tunis,Vente,Appart. 2 pièces');,S plus 1 wahat tel 58258423 fb6887 contacter notre conseillère en immobilière au 58258423  a vendre un appartement s plus 1 encours de construction au 2ème étage avec ascenseur dans une résidence r plus 7 bien gardée et sécurisée à ...');,178000.0,23/11/2024 10:13
66,ben arous,Vente,Appart. 3 pièces');,"Appartement rdc mourouj 5 agence immobilière elkarama met  en vente un bel appartement s+2 réez de chaussée situé dans une résidence au mourouj 5 bien sécurisée et près de toutes  commodités assurance ctama , salle de sport co ...');",120000.0,16/10/2024 12:07
67,ben arous,Vente,Appart. 3 pièces');,"Appartement mourouj 6 s2 hsd agence immobilière el karama met en vente un bel appartement  a mourouj 6 s+2 haut standing 109,8m² situé au 4éme et dernier étage sans voisinage de 3 cotes   de avec ascenseur d une petite résidence  ...');",230000.0,29/06/2024 11:18
68,tunis,Vente,Appart. 3 pièces');,S2 neuf direct promoteur à ain zaghouan agence immobilière le carré 9 vous propose à la vente un appartement s+2 direct promoteur dune superficie de 132m² situé au 2éme étage dune prestigieuse résidence avec double ascenseur à ain zaghoua ...');,450000.0,03/06/2024 12:45
69,tunis,Vente,Appart. 4 pièces');,"S plus 3 cite wahat tel 58258423 fb6807 contacter notre conseillère en immobilier au 58713586 56096179 70727279.  a vendre un appartement s plus 3 au rdc dans une résidence bien sécurisée et bien gardée .il se compose dun salon , cuisi ...');",260000.0,14/11/2024 14:04
70,tunis,Vente,Appart. 3 pièces');,Appt s plus 2 avec meuble à résidence zayatine fb.6458  contacter notre conseillère en immobilière au 50362627 / 56096179 / 70727279.    a vendre un appartement s+2 au 5 ème étage avec ascenseur dans une résidence bien gardée et sécuri ...');,265000.0,23/11/2024 10:25
71,ariana,Vente,Appart. 4 pièces');,Appt s3 neuf à la nouvelle soukra agence immobilière le carré 9 vous propose à la vente un appartement s3 direct promoteur d une superficie de 168m² situé au 2ème étage dune résidence gardée et sécurisée à la nouvelle soukra.  la ...');,638000.0,16/04/2024 13:42
72,ariana,Vente,Appart. 3 pièces');,Appartement s3 de 194m2  cite ennasr emplacement  cite ennasr.  superficie  194 m².  etage  1er étage.  typologie  s3.    composition   salon avec balcon.  cuisine équipée de hotte plaque et four avec séchoir. ...');,598000.0,26/11/2024 16:49
73,tunis,Vente,Appart. 2 pièces');,S plus 2 cite el wa7at fb.7089  contacter notre agent en immobilière au 58713586 / 56096179 / 70727279.  a vendre un appartement s+2 dans une résidence bien gardée et sécurisée à cité al wahat proche de toute commod ...');,290000.0,19/11/2024 10:56
74,tunis,Vente,Appart. 3 pièces');,"Appartement retapé à neuf à l avenue de carthage l agence immobilière relasser vous propose à vendre un appartement retapé à neuf à l avenue de carthage dans un immeuble propre,  gardé jour et nuit  situé au 2éme  étage. il est composé d un salon sp ...');",170000.0,25/11/2024 13:23
75,tunis,Vente,Appart. 4 pièces');,Appt s plus 3 avec ppkg et deux celliers fb.6690  contacter notre conseillère en immobilière au 50362627 / 56096179 / 70727279.    a vendre un un appartement s+3 situé au 1 er étage avec ascenseur dans une résidence bien gardée e ...');,340000.0,16/11/2024 13:46
76,ariana,Vente,Appart. 3 pièces');,"S2 212 md menzah 7 appartement s+2  à vendre    helma immobiliere met à la vente un appartement s+2 de 90 m², au 4eme étage, sans ascenseur dans une résidence gardée à menzah 7    il se compose :     ...');",212000.0,26/11/2024 16:37
77,tunis,Vente,Appart. 1 pièce');,A   appartement en duplex  avec  ref111a vecteur immo propose à la vente un duplex avec jardin au 1er étage  à  bellevue  / elouardia   très proche de l?entrée de tunis sur proche de l?autoroute sud a1      emplacement   bellevue <br ...');,380000.0,26/11/2024 16:33
78,ariana,Vente,Appart. 5 pièces+');,"Immeuble vinicius à borj louzir un immeuble sur un terrain de 115 m² situé dans un bon quartier à cité esaha, borj louzir. au rdc, on a un appartement qui se compose par un salon, une cuisine avec séchoir, 2 chambres et une salle de ...');",320000.0,26/11/2024 16:30
79,tunis,Vente,Appart. 2 pièces');,Un grand s plus 1 à cité el wahat fb.7115  contacter notre conseillère en immobilière au 50362627 / 56096179 / 70727279.    a vendre un appartement s+1 au 4 ème étage avec double ascenseurs dans une résidence bien gardée e ...');,183000.0,23/11/2024 16:05
80,tunis,Vente,Appart. 2 pièces');,"S plus 2 ain zaghouan nord pres monoprix fb.6899  contacter notre conseiller en immobilier au 58173586 / 56096176 / 70727279  a vendre un appartement s+2 avec meuble située au 3eme etage dans une residence sécurisée et bien gardée, i ...');",680000.0,16/10/2024 14:30
81,tunis,Vente,Appart. 2 pièces');,S plus 1 soukra tel 58258423 fb6964 contacter notre conseiller en immobilier au 56306032 56096179 70727279.  a vendre un appartement s plus 1 sur plan à la soukra dans une résidence r plus 2 sécurisé compose dun :  salon  k ...');,225000.0,14/11/2024 14:01
82,ariana,Vente,Appart. 4 pièces');,"S3 à ennasr 2 a vendre un appartement a usage de bureaux aux mezzanines d un immeuble bien situé sur l avenue hedi nouira à ennasr proche de la poste. titre foncier individuel, kitchenette et sanitaires.');",250000.0,21/08/2024 13:27
83,ben arous,Vente,Appart. 4 pièces');,"Appartement mourouj 156m2  promoteur appartement a vendre s+3 mourouj 6 156m2 3x balcon , 5x climatiseurs 1x place parking , 1x cellier  vue dégagée  reg fiscal 1  prix. 380000 md légèrement négociable   pour plus d info ou visit ...');",380000.0,26/11/2024 15:42
84,ariana,Vente,Appart. 2 pièces');,S plus 2 chotrana tel 58258423 7050 contacter notre conseiller en immobilier au 58258423 56096179 70727279.  a vendre un appartement s plus 2 avec un terrasse 3m à chotrana 1 dans une résidence r plus 2 sécurisé compose dun :   ...');,460000.0,14/11/2024 12:56
85,ariana,Vente,Appart. 2 pièces');,"S plus 1 rue de parc tel 58258423 fb7095 contacter notre conseillère en immobilier au 58258423 56096179 70727279  a vendre un appartement s plus 1 au 3éme étage avec ascenseur à rue de parc il se compose dun salon, chambre à coucher, dr ...');",340000.0,19/11/2024 14:53
