,Gouvernorat,Nature,Type,Description,Price,Insertion Date
866,tunis,Vente,Appart. 1 pièce');,"Cabinet medical a la marsa l agence immobilière crown met en location un beau bureau de 55m², situé à la marsa au gouvernorat de tunis, à usage professionnel. ce bureau au 1er étage,  se compose d un hall, un bureau, une salle  ...');",260000.0,25/02/2024 18:09
867,ariana,Vente,Appart. 3 pièces');,Un triplex à la soukra ib4065 l agence immobilière first home met à votre disposition la vente d un triplex à la soukra pas loin de la monoprix dans l une des meilleures résidence   un triplex de 300 m2 avec jardin  <br ...');,850000.0,07/11/2024 15:47
868,ariana,Vente,Appart. 2 pièces');,"S2 neuf à vend à chotrana 1 cle d or immobilier met en vente   un neuf appartement jamais habité au 2ème étage d une résidence calme et sécurisée à chotrana1, la soukra. il se compose d un salon donnant sur un balcon, une cu ...');",425000.0,03/09/2024 15:20
869,ariana,Vente,Appart. 1 pièce');,Local commercial    riadh ref93a just on time immo met à votre disposition un local commercial pour la vente à riadh landalous.  pour plus d?informations   /  3 pieces.');,932750.0,07/11/2024 13:43
870,ariana,Vente,Appart. 3 pièces');,"S3 neuf jamais habité à la soukra clé d or immobilier met en vente  un appart s3 sur plan situé au 1er étage d une nouvelle résidence moderne à la soukra. a l entrée, on a un salon, une cuisine équipée avec séchoir, une suite pare ...');",807240.0,05/09/2024 17:13
871,ben arous,Vente,Appart. 2 pièces');,"Rdc de villa divine à ben arous un rdc de villa sur un terrain de 136 m², situé dans un quartier résidentiel à ben arous. à lentrée, on trouve un salon, une cuisine, 2 chambres et une salle d eau avec douche à l italienne. à lexté ...');",150000.0,07/11/2024 12:54
872,tunis,Vente,Appart. 2 pièces');,"Grand s2 haut standing avenir immobilier met en vente un s2 à ain zaghouan nord dans une résidence avec piscine de très haut standing, l appart au deuxième étage avec ascenseur très spacieux lumineux contient un grand salon ...');",670000.0,29/02/2024 13:54
873,tunis,Vente,Appart. 5 pièces+');,Bureaux avec magasin a vendre des bureaux proche de la cnam situé au rez de chaussée d un immeuble bureautique avec un magasin de 40 mètres carrés et deux places de parking et un cellier archives au sous sol.  a noter ...');,980000.0,20/02/2023 09:55
874,tunis,Vente,Appart. 4 pièces');,Nord hilton appartement -ssam- 3 chambres à coucher-sbd-s d eau et cuisine.  140m2 au 3 ème étage avec ascenseur .  très bel emplacement stratégique   nord hilton face clinique taoufik  quartier c ...');,390000.0,07/11/2024 11:35
875,ariana,Vente,Appart. 2 pièces');,"S2 jamais habité à la soukra clé d or immobilier met en vente  un chic appart s2 sur plan situé au 2ème étage d une nouvelle résidence moderne à la soukra. a l entrée, on a un salon avec balcon, une cuisine équipée avec sécho ...');",398040.0,05/09/2024 17:18
876,ben arous,Vente,Appart. 5 pièces+');,"Immeuble angelika à borj cédria un immeuble de charme sur un terrain de 630 m², situé dans un quartier résidentiel à borj cedria, ben arous. au rdc, il y a un appartement composé dun salon, dune cuisine équipée, de 3 chambres et d ...');",800000.0,05/09/2024 11:13
877,ben arous,Vente,Appart. 3 pièces');,"Immeuble florentina à boumhal un immeuble sur un terrain de 300 m² situé dans un bon quartier à boumhal. au rdc, on a un appartement qui se compose par un salon, une cuisine, une salle d eau, 3 chambres et une salle de bain. au 1  ...');",800000.0,04/09/2024 13:20
878,ben arous,Vente,Appart. 3 pièces');,"Appartement s3 haut standing a boumhel bassatine cet appartement se situe au 2eme etage  d une residence securisée a    boumhal bassatine. il est composée  d un spacieux salon lumineux, la cuisine est totalement équipée  d une plaque de cuisson, ...');",320000.0,16/07/2024 13:46
879,ben arous,Vente,Appart. 2 pièces');,Apprt s1 à mourouj prés marché de gros fb.  contacter notre conseiller en immobilier au 56306032 / 56096179 / 70727279  a vendre un appartement s1 direct promoteur dans une résidence bien sécurisé située à à bir el kasaa ben arous  ...');,110000.0,07/11/2024 10:41
880,ben arous,Vente,Appart. 3 pièces');,"Duplex cherrysia à mégrine riadh un duplex d une superficie de 60 m² situé dans un bon quartier sur la route principale à mégrine riadh. au rdc, on a un salon, une salle d eau et un garage. a l étage, on a une cuisine et 3 chambres.  ...');",250000.0,04/09/2024 11:47
881,tunis,Vente,Appart. 4 pièces');,Un joli duplex s3 avec terrasse au manar l agence darek immobilière propose à la vente une joli duplex avec grand terrasse de type s3 dans  une résidence de bon standing située au manar.  l  appartement est doté d une surface généreuse a ...');,550000.0,23/07/2024 13:23
882,ariana,Vente,Appart. 2 pièces');,"S2 neuf jamais habité à la soukra clé d or immobilier met en vente  un neuf appart s2 sur plan situé au rdc d une nouvelle résidence moderne à la soukra. a l entrée, on a un salon avec une jolie terrasse donnant sur un jardin d un ...');",472440.0,05/09/2024 17:09
883,tunis,Vente,Appart. 3 pièces');,"S3 flores à bab fella montfleury un appart à rénover appartement au rdc situé dans un immeuble en plein centre ville à bab fella, montfleury. a l entrée, on a un salon avec balcon, une cuisine, 3 chambres et une salle de bain. pour t ...');",115000.0,07/11/2024 09:57
884,ben arous,Vente,Appart. 3 pièces');,"Villa fatiha à rades plage une villa sur un terrain de 126 m² situé dans un quartier résidentiel à rades plage. au rdc, on a un salon, une cuisine, 3 chambres et une salle d eau pour les invités. a l étage, on a une chambre, un ...');",245000.0,03/09/2024 14:00
885,tunis,Vente,Appart. 3 pièces');,"Appart toffee au kram un appart s+3 au 1 er étage situé dans une résidence à cité l office au kram.  a l entrée, on trouve un grand salon, une cuisine, 3 chambres et une salle de bain. pour tous les renseignements, contact ...');",350000.0,07/11/2024 09:41
886,tunis,Vente,Appart. 3 pièces');,"Appt au troisième étage l appartement est composé d un grand salon avec balcon, cuisine entièrement équipée,trois chambres a coucher dont deux avec balcon, placard au niveau du couloir, sde et sdb  l appartement se trouv ...');",320000.0,07/11/2024 09:31
887,tunis,Vente,Appart. 3 pièces');,"S3 aghar à l aouina un appart s3 au 1er étage situé dans une résidence à laouina. a lentrée, on trouve un salon avec balcon, une cuisine avec séchoir, 3 chambres et une salle de bain. veuillez contacter lagent sur le  ...');",440000.0,07/11/2024 09:27
888,ben arous,Vente,Appart. 3 pièces');,"Appart s3 edmond à rades un appart au rdc situé dans une résidence à rades. a l entrée, on a un salon avec balcon, une cuisine, une suite parentale,  2 chambres, une salle de bain et une place de parking au sous-sol. pour tou ...');",250000.0,07/11/2024 09:01
889,tunis,Vente,Appart. 1 pièce');,"S0 côté clinique soukra s0 en cours de finition côté clinique la soukra, livraison novembre 2024');",140000.0,15/08/2024 11:31
890,ben arous,Vente,Appart. 4 pièces');,"Bel app à medina jadida a vendre un bel appartement à medina jadida dans une résidence gardée et sécurisée comprenant  3 ch, salon, salle de bain, salle d eau, cuisine équipée, séchoir etc.  il a été rénové et très bien  ...');",240000.0,04/07/2024 09:09
891,tunis,Vente,Appart. 4 pièces');,"Appartement neuf à la cité olympique vous recherchez un appartement moderne et confortable ? ne cherchez plus ! cet appartement s+3 de 110m², entièrement rénové en 2017, est fait pour vous. situé au 3ème étage d une résidence calme et sé ...');",320000.0,04/10/2024 15:56
892,tunis,Vente,Appart. 4 pièces');,"Rue de russie vnt s3 #centre ville,rue de russie vente dun app s+3 :     ketata immo,  met en  vente en exclusivité au centre ville , rue de russie, près place mongi bali, et gare du train, un s+3 +grand hall+1 b ...');",200000.0,03/08/2024 19:26
893,manouba,Vente,Appart. 3 pièces');,"Manouba vnt s2 ketata.immo, met en vente  en plein centre de manouba, dans une nouvelle résidence près de la mosquée du centre manouba :  s+2 de 88 m2 de très bon standing,   très bien orienté (charki-kebli), <b ...');",210000.0,11/06/2023 20:15
894,tunis,Vente,Appart. 3 pièces');,Appartement rez de chaussée appartement à vendre à cité ibn khaldoun près de x3');,120000.0,06/11/2024 18:27
895,ariana,Vente,Appart. 3 pièces');,"Ariana soghra vnt s2 106 ketata immo, met en vente à ariana soghra un appartement s2 de 106 m2.    l appartement se trouve au 4 ème étage avec double ascenseur.  appartement bien orienté charky, ensoleillé, vue dé ...');",230000.0,12/07/2024 09:53
896,tunis,Vente,Appart. 3 pièces');,Appt s2 neuf à ain zaghouan nord agence immobilière le carré 9 vous propose à la vente un appartement s2 neuf direct promoteur dune superficie de 177.5m² situé au 3éme étage dune résidence gardée et sécurisée avec double ascenseurs ...');,675000.0,16/04/2024 11:56
897,ariana,Vente,Appart. 1 pièce');,Appart neuf promoteur avenir immobilier met en vente à cité ennaser 2 coté nouveau mall dans une résidence neuf jamais habité et de très haut standing les trois dernière appartement s1 des surfaces 58 mètre carré 64 et 76. ...');,233000.0,08/07/2024 15:17
898,ben arous,Vente,Appart. 5 pièces+');,"Immeuble silvestro à yassminette ben arous un immeuble sur un terrain de 220 m² situé dans un bon quartier à yassminette, ben arous. au rdc, on a un appartement s3 qui se compose par un salon, une cuisine, 3 chambres et une salle de bain. de m ...');",450000.0,25/09/2024 13:09
899,tunis,Vente,Appart. 4 pièces');,Appt s3 neuf à ain zaghouan sud agence immobilière le carré 9 met à la vente un appartement s3 de 163m² direct promoteur au 1er étage dune résidence  r4 en cours dexécution avec double ascenseur à ain zaghouan à proximité de la ro ...');,734000.0,22/06/2024 14:43
900,tunis,Vente,Appart. 3 pièces');,Aprt s2 a la marsa a vendre  à la marsa ds un résidence gardée un aprt s2 standing compose d un salon + 2 chambres avec dressing +cuisine équipée + salle de bain + salle d eau + chauffages + climatisations+ place parkin ...');,750000.0,04/11/2024 16:54
901,ben arous,Vente,Appart. 3 pièces');,"Appart bonanova à borj cedria un appart s+3 au 4 éme étage situé dans une résidence à borj cédria. a l entrée, on a un salon avec balcon, une cuisine avec séchoir, une salle d eau, 3 chambres et une salle de bain . pour tous les r ...');",155000.0,06/11/2024 16:02
902,tunis,Vente,Appart. 1 pièce');,"S1 avec jardin aux jardins de carthage cle d or immobilier met en vente  un neuf appartement s1 de haut standing dans une résidence bien gardée et calme aux jardins de carthage. ce dernier est composé d un salon-salle à manger, d une c ...');",443000.0,10/09/2024 14:14
903,tunis,Vente,Appart. 2 pièces');,"S2 v aux jardins de carthage clé d or met à vendre  cet appartement occupe une résidence sécurisée et bien entretenue qui se compose d un spacieux salon, une salle à manger, une cuisine équipée avec un séchoir, une salle d ea ...');",490000.0,31/07/2024 11:43
904,tunis,Vente,Appart. 4 pièces');,Un grand s3 à manar 2 l agence branché immobilière vous propose à la vente un spacieux appartement en s+3 au 4éme étage avec ascenseur à el manar 2 à coté café folla dans une résidence calme et sécurisée par des caméras de ...');,265000.0,06/11/2024 15:40
905,manouba,Vente,Appart. 4 pièces');,"Appart s3 anadela à manouba un coquet appart au rdc situé dans une résidence à la manouba. a l entrée, on trouve un salon avec balcon, une cuisine avec séchoir, 3 chambres et une salle de bain. cet appart dispose d une place de  ...');",245000.0,06/11/2024 15:36
906,ariana,Vente,Appart. 1 pièce');,Apprt s1 à la soukra   rue ras jdir fb.6727  contacter notre conseillère en immobilier au 56306032/ 56096179 / 70727279  a vendre un appartement s+1 au 1ér étage sans ascenseur à soukra il se compose   salon  chambre à c ...');,138000.0,06/11/2024 15:35
907,ben arous,Vente,Appart. 3 pièces');,Spacieux appartement au rdc spacieux appartement au rdc avec place parking dans une résidence très bien entretenu sur le boulevad principal');,155000.0,06/11/2024 14:41
908,ben arous,Vente,Appart. 2 pièces');,Appartements s1 au premier étage spacieux s1 au premier étage   zone résidentielle très demandez pré de tout commodité   opportunité à saisir');,85000.0,06/11/2024 14:27
909,ben arous,Vente,Appart. 3 pièces');,Gps appart bonne opportunité appart de 3 pièces au deuxième étage immeuble en face de l arrêt du métro bir el bey à 2mn tout prés de la pharmacie de nuit l appart alimenté rn gaz  de ville éléctricité et eau se compose de deux ch ...');,140000.0,29/08/2023 16:11
910,ariana,Vente,Appart. 1 pièce');,"S1 v à la nouvelle soukra il se compose d un lumineux salon, une cuisine équipée, une spacieuse chambre à coucher et une salle de bain moderne.  pour tous renseignements, veuillez nous appeler sur le 98191092.');",180000.0,03/08/2024 11:59
911,ben arous,Vente,Appart. 5 pièces+');,Deux appartements indépendant l agence immobilière maison+ met en vente deux  étage  indépendant dans une résidence semi collectif situé à mourouj 4  dans un cartier résidentiel  près de tout commodité         chaque e ...');,290000.0,21/10/2024 21:59
912,tunis,Vente,Appart. 3 pièces');,Ysgwxcmpokkl une villa style américain a ibn khaldoun juste en face de boulangerie paris et le café');,290000.0,06/11/2024 13:34
913,ben arous,Vente,Appart. 3 pièces');,"Appartement s2 au mourouj 3 nous mettons en vente un appartement s2 au 2 éme étages au mourouj 3 près du métro , commerces , collège , monoprix :   salon + 2 chambres + cuisine avec séchoir + parking   contactez nous au  ...');",120000.0,06/11/2024 12:43
914,tunis,Vente,Appart. 2 pièces');,Petite mison notre agence a vente un petite mison s1  a marsa se compose   salon   2 chambre   sallw d eau   pour plus d information merci de nous contacter 55 784 526');,210000.0,05/11/2024 14:34
915,ariana,Vente,Appart. 2 pièces');,Apprt  s1 à la soukra encours de construction fb.6964  contacter notre conseiller en immobilier au 56306032 / 56096179 /70727279.  a vendre un appartement s1 sur plan à la soukra dans une résidence r+2 sécurisé compose dun :  salon < ...');,225000.0,06/11/2024 11:53
916,ben arous,Vente,Appart. 4 pièces');,"Appartement s plus 3 appartement s+3 au 2ème étage d une résidence gardée et sécurisée avec femme de ménage et syndic, il se compose de 3 chambres, salle de bain, cuisine et balcon, très bien entretenu et retapé à neuf. < ...');",199000.0,16/07/2024 09:56
917,tunis,Vente,Appart. 4 pièces');,Fonds de commerce à ain zaghouen nord la marsa fonds de commerce   situé sur la route principale ain zaghouen nord la marsa   300md légèrement négociable / tous commerces   400m2 loyer 4md/mo');,300000.0,02/11/2024 09:43
918,tunis,Vente,Appart. 3 pièces');,"Cité khadra appt au 1er étage a vendre a cité khadra en face ibn zohr appt snit au 1er étage se compose de deux gd chambres et une petite pièce, sdb, cuisine. 142 milles dinars  (actuellement loué a 700d/mois) pour visiter contact ...');",142000.0,28/09/2024 15:19
919,ben arous,Vente,Appart. 3 pièces');,"Villa limem s3 à boumhal une villa plain pied sur un terrain de 213 m² dans un bon quartier à boumhal.  a l entrée , on a un salon , une cuisine équipée avec séchoir , 3 chambres à coucher et  une salle de bain . a l extérieu ...');",270000.0,06/11/2024 11:00
920,ariana,Vente,Appart. 4 pièces');,Appartement  s3 à soukra  côté kiabi 2 ème étage sans ascenseur  dans  grand  résidence    sallon  avec  balcon   coin salle  à manger   salle  d eau    cuisine  bien avec  séchoir    3 chambres  à coucher  avec  placards ...');,380000.0,05/11/2024 11:57
921,tunis,Vente,Appart. 1 pièce');,Appartement s1 cite wahat au 7eme etage notre agence le palais  met a la vente  un appartement  s1 au 7éme étage  haut standing avec double ascenseurs dans  une résidence gardé    située :   cité wahat   composé de :     ...');,180000.0,24/10/2024 12:57
922,ben arous,Vente,Appart. 2 pièces');,"Appart s2 saguar à hammam lif un appartement au 2éme étage situé dans un bon quartier à hammam lif. a l entrée, on a un salon avec balcon, une cuisine, 2 chambres et une salle de bain. pour tous les renseignements, contacter l age ...');",125000.0,06/11/2024 09:45
923,tunis,Vente,Appart. 2 pièces');,Appartement a la goulette neuv agence kamel la goulette met en vente un appartement au 3 em ètages dans une rèsidence calme  se compose d un salon chambre a coucher salle d eaux .cuisine et une grande terrace de 30 m²');,180000.0,06/11/2024 09:36
924,tunis,Vente,Appart. 1 pièce');,Appartement  s1 cite wahat jamais habite notre agence le palais  met a la vente  un appartement  s1 au 2éme étage jamais habité  avec ascenseur  dans  une résidence gardé    située :  cité wahat  composé de :    salon  <b ...');,19000.0,10/10/2024 11:44
925,ariana,Vente,Appart. 4 pièces');,"Ariana jdida gd appt au 1er étage a vendre à ariana jdida près menzah8 bel appt renouveler situé au 1er étage se compose de gd salon salle à manger, 3 chambres avec placards, sdb, cuisine équipée. l appartement est équipé du chauffage ...');",280000.0,02/09/2024 09:24
926,ben arous,Vente,Appart. 5 pièces+');,"Immeuble lara a rades plage un immeuble de haut standing situé dans un bon quartier à rades plage. au rdc, on trouve un salon , une cuisine bien équipée, 3 chambres et une salle de bain.  au 1ére étage, on a de méme un salon, un ...');",550000.0,05/11/2024 16:53
927,ben arous,Vente,Appart. 5 pièces+');,"Immeuble lara à rades plage un immeuble de haut standing situé dans un bon quartier à rades plage. au rdc, on trouve un salon , une cuisine bien équipée, 3 chambres et une salle de bain.  au 1ére étage, on a de méme un salon, un ...');",550000.0,05/11/2024 16:52
928,tunis,Vente,Appart. 3 pièces');,Appartement rénové situé à goulette l appartement occupe le 1er étage dune résidence.  lappartement se distingue par son emplacement en face de l arrêt du train tgm de la goulette ancienne et sa proximité à toutes les commodités n ...');,190000.0,05/11/2024 16:43
929,ariana,Vente,Appart. 4 pièces');,"Appartement au rdc à el menzah 8 s3 appartement louiza (réf: v810)  a vendre chez lagence tps immobilière hammamet, un magnifique appartement au rez chaussé, bien orienté, situé a menzah 8.  il est composé dun salon, suite par ...');",430000.0,05/11/2024 16:17
930,ariana,Vente,Appart. 5 pièces+');,"Appartement s4 à menzah 8 v2611 appartement louiza 1 (réf: v2611)  lagence tps immobilière hammamet met à la vente un bel appartement de type s+4 au 5ème étage très bien orienté dans une résidence gardée et sécurisée, situé à m ...');",580000.0,05/11/2024 15:43
931,tunis,Vente,Appart. 2 pièces');,"Duplex monica à ain zaghouan un duplex avec une entrée commune situé dans un quartier calme à ain zaghouan. au 1er étage, on a un salon et une cuisine. au 2éme étage, on trouve 2 chambres à coucher et une salle de bain. pour tous ...');",220000.0,05/11/2024 15:25
932,tunis,Vente,Appart. 3 pièces');,"Des appartements av jardins de carthage résidence serenya (réf: v2783)   à vendre chez l agence tps immobilières, un nouvel ensemble résidentiel bien situé aux jardins de carthage, à tunis.  de type r3, la résidence offre des duplex ...');",592600.0,05/11/2024 15:12
933,ariana,Vente,Appart. 1 pièce');,"Luxueux s1 meublé à v à chotrana1 clé d or immobilier met en vente  un luxueux appart s1 meublé au rdc situé dans une résidence bien sécurisée à chotrana1, la soukra. a l entrée, on a un salon donnant sue un joli jardin d une supe ...');",300000.0,28/08/2024 17:07
934,tunis,Vente,Appart. 2 pièces');,"Appart s2 trèfle à lafayette un appart au 1 er étage situé dans un immeuble sans ascenseur à lafayette, tunis. a l entrée, on a un salon, une cuisine, 2 chambres et une salle de bain. pour tous les renseignements, contacter l age ...');",130000.0,30/07/2024 11:42
935,tunis,Vente,Appart. 1 pièce');,Appartement jardin laouinat s1 au 6eme etage notre agence le palais  met a la vente  un appartement  s1 au 6éme étage  haut standing avec double ascenseurs dans  une résidence gardé    située :   jardin l aouina  composé de : <br ...');,165000.0,04/11/2024 11:10
936,ben arous,Vente,Appart. 4 pièces');,App  haut standing  s et 3chamb app haut standing   grand salon et 3  chambres  cuisine  deux salle d eau   balcon   sechoir  chaufage centrale  4  climatiseurs 24000/12000/9000/7000 btu  encenseur  < ...');,347000.0,14/10/2024 16:11
937,tunis,Vente,Appart. 1 pièce');,"S1 v neuf s1 à laouina c est un appartement de haut standing situé dans une résidence gardée et calme à l aouina qui se compose d un salon-salle à manger, une cuisine aménagée et équipée avec un séchoir, une chambre à couch ...');",250000.0,02/08/2024 13:34
938,tunis,Vente,Appart. 3 pièces');,"S3 neuf à v aux jardins de carthage clé d or immobilier vous propose  un luxueux appart s3 jamais habité au 3ème étage situé dans une résidence bien gardée aux jardins de carthage. a l entrée, on trouve un spacieux salon avec un dre ...');",785000.0,27/08/2024 10:58
939,tunis,Vente,Appart. 4 pièces');,"Appart s3 yaounde à lafayette un appart au 2 éme étage situé dans une résidence sans ascenseur à lafayette. a l entrée, on a un salon avec balcon, une cuisine, 3 chambres et une salle de bain. pour tous les renseignements, contact ...');",240000.0,20/08/2024 11:35
940,ben arous,Vente,Appart. 4 pièces');,"Occasion à saisir pour déménagement à l étranger, je mets en vente un bel appartement à rades forêt, composé d un salon et trois chambres à coucher, une cuisine équipée, une salle de bain avec douche italienne une sall ...');",225000.0,05/11/2024 12:53
941,tunis,Vente,Appart. 3 pièces');,"Appartement à manar 2 a vendre à manar 2 un bel appartement s + 2 situé au 2ème étage à la cité el moez près de la pâtisserie pyramide. l appartement est aéré et bien orienté, bénéficie d une vue dégagée dans une résidence ...');",230000.0,05/11/2024 12:51
942,ben arous,Vente,Appart. 4 pièces');,Gps  rdc appart s3 résidence essaada un appart de 3 façade rdc  salon plus 3 chambres cuisine salle de bain douche  deux balcons un séchoir dégagé sur une rue avec petit jardin et terrain nu tyout autour prix lègerement négociable  vent ...');,135000.0,28/10/2024 14:23
943,manouba,Vente,Appart. 2 pièces');,Un appartement s1 hs au 1er étage a manouba agence med ali zaeir el manar 2 met a votre disposition un appartement s+1 haut standing au 1er étage (avec ascenseur) a vendre situé a manouba prés de palais kobbet el nehas.  il est composé comm ...');,180000.0,09/08/2024 14:35
944,tunis,Vente,Appart. 2 pièces');,"Deux fenêtre de protection en métal deux fenêtre de protection en métal, largeur 88cm et  longueur 1m 88cm ( nouveau nouveau ). 400d');",400000.0,05/11/2024 11:13
945,tunis,Vente,Appart. 4 pièces');,"Appartement s4 à el manar 2 on vous propose un appartement  s4 à el manar 2 doté dune superficie 143 m², bénéficiant dune superbe orientation situé au 3éme étage le dernier étage dans une petite résidence r3 dans un emplacemen ...');",310000.0,05/11/2024 11:05
946,tunis,Vente,Appart. 1 pièce');,S plus 2 a cite wahat laouina fb.4768    contacter notre conseillère en immobilier au 51004658 / 56096179 / 70727279.    a vendre un appartement s+1 sur plan direct promoteur dans une nouvelle résidence avec un bon ...');,215000.0,12/02/2024 13:11
947,tunis,Vente,Appart. 2 pièces');,"Appartement s2 à cité les palmeraies emplacement : cité les palmeraies.  superficie : 89 m².  etage : 7ème étage  typologie : s+2.    composition :   salon avec balcon.   cuisine équipée de plaque, hotte et fo ...');",215000.0,05/11/2024 10:37
948,ariana,Vente,Appart. 1 pièce');,Usine soukra tunis a vendre une usine au centre de la région de l ariana une construction de deux niveaux ( atelier de menuiserie moderne) superficie 2000 m² sur un terrain de 945 m² situé à la zone industriel de la sou ...');,2000000.0,28/04/2023 10:34
949,tunis,Vente,Appart. 5 pièces+');,Un duplex s4 spacieux au rdc a manar 2 agence med ali zaeir el manar 2 met a votre disposition un duplex s+4 spacieux au rdc dans une résidence a vendre situé a manar 2 prés de sonede.  il est composé comme suit:  *un spacieux salo ...');,400000.0,03/08/2024 12:05
950,tunis,Vente,Appart. 3 pièces');,Appt s2 direct promoteur à ain zaghouan nord agence immobilière le carré 9 vous propose à la vente un appartement s2 neuf direct promoteur dune superficie de 166.25m² situé au 2éme étage dune résidence gardée et sécurisée avec double ascenseur ...');,632000.0,15/04/2024 18:23
951,ariana,Vente,Appart. 4 pièces');,Un appartement s3 a ennacer 2 en face monoprix une agente immobilière met a votre disposition un appartement s+3 au 6éme étage (avec doubles ascenseurs) a vendre situé a ennacer 2 en face monoprix (sur avenue hedi nouira)   il est composé comm ...');,310000.0,09/07/2024 14:10
952,ariana,Vente,Appart. 2 pièces');,Apprt s1 à la soukra rue ras jdir fb.6727  contacter notre conseillère en immobilier au 56306032/ 56096179 / 70727279  a vendre un appartement s1 au 1ér étage sans ascenseur à soukra il se compose :  salon  chambre à c ...');,140000.0,05/11/2024 09:42
